{
  "module_id": "urn:caeluviim:module:rrkc:r2",
  "version": "2.0.0",
  "status": "proposed",
  "tower": ["R0", "RE", "RR", "RS", "RX"],
  "sorts": [
    "Entity",
    "Claim",
    "Evidence",
    "Relation",
    "Activity",
    "Agent",
    "Policy",
    "Provenance",
    "Prop",
    "Code(tau)",
    "Arrow(tau1,tau2)"
  ],
  "term_constructors": [
    {"name": "var", "arguments": ["name", "sort"], "result": "tau", "layer": "R0"},
    {"name": "id", "arguments": ["identifier"], "result": "Entity", "layer": "R0"},
    {"name": "claim", "arguments": ["Claim"], "result": "Entity", "layer": "R0"},
    {"name": "evidence", "arguments": ["Evidence"], "result": "Entity", "layer": "R0"},
    {"name": "rel", "arguments": ["relation-symbol", "tau1", "tau2"], "result": "Relation", "layer": "R0"},
    {"name": "act", "arguments": ["operation-symbol", "vector(term)"], "result": "declared-output-sort", "layer": "R0"},
    {"name": "stamp", "arguments": ["tau", "Provenance"], "result": "tau", "layer": "R0"},
    {"name": "revise", "arguments": ["tau", "tau"], "result": "tau", "layer": "R0"},
    {"name": "version", "arguments": ["tau", "version-id"], "result": "tau", "layer": "R0"},
    {"name": "lambda", "arguments": ["x:tau1", "tau2"], "result": "Arrow(tau1,tau2)", "binds": ["x in body"], "layer": "R0"},
    {"name": "application", "arguments": ["Arrow(tau1,tau2)", "tau1"], "result": "tau2", "layer": "R0"},
    {"name": "let", "arguments": ["x:tau1", "tau1", "tau2"], "result": "tau2", "binds": ["x in body"], "layer": "R0"},
    {"name": "quote", "arguments": ["tau"], "result": "Code(tau)", "layer": "RE"},
    {"name": "decode", "arguments": ["canonical Code(tau)"], "result": "tau", "layer": "RE", "partial": true},
    {"name": "eval", "arguments": ["Code(tau)"], "result": "tau", "layer": "RR", "partial": true},
    {"name": "internal-run", "arguments": ["Code(RS)", "tau"], "result": "execution-result", "layer": "RS", "partial": true}
  ],
  "proposition_constructors": [
    {"name": "top", "result": "Prop", "layer": "R0"},
    {"name": "bottom", "result": "Prop", "layer": "R0"},
    {"name": "not", "arguments": ["Prop"], "result": "Prop", "layer": "R0"},
    {"name": "and", "arguments": ["Prop", "Prop"], "result": "Prop", "layer": "R0"},
    {"name": "or", "arguments": ["Prop", "Prop"], "result": "Prop", "layer": "R0"},
    {"name": "implies", "arguments": ["Prop", "Prop"], "result": "Prop", "layer": "R0"},
    {"name": "forall", "arguments": ["x:tau", "Prop"], "result": "Prop", "binds": ["x in proposition"], "layer": "R0"},
    {"name": "exists", "arguments": ["x:tau", "Prop"], "result": "Prop", "binds": ["x in proposition"], "layer": "R0"},
    {"name": "term-equality", "arguments": ["tau", "tau"], "result": "Prop", "layer": "R0"},
    {"name": "supports", "arguments": ["Evidence", "Claim"], "result": "Prop", "layer": "R0"},
    {"name": "rebuts", "arguments": ["Evidence", "Claim"], "result": "Prop", "layer": "R0"},
    {"name": "admissible", "arguments": ["governance-transition"], "result": "Prop", "layer": "R0"},
    {"name": "derived-from", "arguments": ["Entity", "Entity"], "result": "Prop", "layer": "R0"}
  ],
  "relation_signatures": [
    {"symbol": "supports", "left": "Evidence", "right": "Claim"},
    {"symbol": "rebuts", "left": "Evidence", "right": "Claim"},
    {"symbol": "derivedFrom", "left": "Entity", "right": "Entity"},
    {"symbol": "governedBy", "left": "Entity", "right": "Policy"}
  ],
  "operation_signatures": [
    {"symbol": "publish", "inputs": ["Claim"], "output": "Activity"},
    {"symbol": "validate", "inputs": ["Claim", "Evidence"], "output": "Activity"},
    {"symbol": "ratify", "inputs": ["Policy"], "output": "Activity"}
  ],
  "judgments": [
    "Gamma |- e wf",
    "Gamma |- e : tau",
    "Gamma |- phi prop",
    "Gamma |- pi : phi",
    "Gamma |- e1 = e2 : tau",
    "Gamma |- e1 equiv e2 : tau",
    "Gamma;Gamma_G |- e -> e'",
    "Gamma;Gamma_G |- e ->* e'",
    "Gamma |- evidence supports claim",
    "Gamma |- evidence rebuts claim",
    "Gamma_G |- transition admissible",
    "Gamma_G |- q --sigma--> q' |- Gamma_G'",
    "Pi |- n1 prec n2",
    "Pi |- e derivedFrom e'",
    "Gamma |- c canonicalCode(tau)",
    "Gamma;Gamma_G |- eval(c) -> e"
  ],
  "governance_operations": ["amend", "ratify", "revoke", "delegate", "veto", "suspend", "restore"],
  "provenance": {
    "order_convention": "strict-irreflexive-transitive-acyclic",
    "event_fields": ["event_id", "label", "inputs", "outputs"],
    "replay_requirement": "provenance-isomorphism-and-semantic-equality"
  },
  "termination_fragment": {
    "name": "K_SN",
    "restriction": "No eval occurs beneath quote; recursive calls are structurally decreasing; Code levels strictly decrease across eval.",
    "measure": "lexicographic pair of maximum Code level and reducible-term size",
    "global_strong_normalization_claimed": false
  },
  "theorems": [
    {"id": "T1", "name": "Decidable formation", "scope": "R0", "status": "executable-instance-checked", "verification": "reference_model.type_of and JSON structural tests"},
    {"id": "T2", "name": "Substitution", "scope": "R0", "status": "executable-instance-checked", "verification": "capture-avoiding substitution and sort-preservation instance tests"},
    {"id": "T3", "name": "Weakening", "scope": "R0", "status": "specified", "verification": "Lean theorem statement in formal/rrkc/RRKC/Metatheory.lean"},
    {"id": "T4", "name": "Exchange", "scope": "nondependent R0 contexts", "status": "specified", "verification": "context permutation condition made explicit"},
    {"id": "T5", "name": "Contraction", "scope": "unrestricted R0 assumptions only", "status": "specified", "verification": "resource-sensitive assumptions excluded"},
    {"id": "T6", "name": "Preservation", "scope": "R0 governed reduction", "status": "executable-instance-checked", "verification": "reference_model.preservation_holds tests beta, let, eval-quote, governed revision"},
    {"id": "T7", "name": "Governed progress", "scope": "R0 governed reduction", "status": "executable-instance-checked", "verification": "value, reduction, and explicit blocked outcomes"},
    {"id": "T8", "name": "Definitional equality soundness", "scope": "R0 denotation", "status": "specified", "verification": "proof obligation declared in normative specification"},
    {"id": "T9", "name": "Local confluence", "scope": "R0 critical pairs", "status": "specified", "verification": "critical-pair proof obligation declared"},
    {"id": "T10", "name": "Global confluence", "scope": "K_SN", "status": "specified", "verification": "requires T9 and termination by Newman's lemma"},
    {"id": "T11", "name": "Normalization soundness", "scope": "K_SN", "status": "specified", "verification": "normalizer is partial outside K_SN"},
    {"id": "T12", "name": "Normal-form canonicality", "scope": "observational K_SN fragment", "status": "specified", "verification": "observation contexts must be complete for fragment"},
    {"id": "T13", "name": "Decode quote", "scope": "RE", "status": "specified", "verification": "structural induction including binder alpha-renaming"},
    {"id": "T14", "name": "Reflection soundness", "scope": "canonical RR code", "status": "executable-instance-checked", "verification": "eval(quote(e)) reduces to e in reference model"},
    {"id": "T15", "name": "Provenance preservation", "scope": "replay", "status": "executable-instance-checked", "verification": "event, label, input, output, and strict-order preservation"},
    {"id": "T16", "name": "Replay correctness", "scope": "replay", "status": "executable-instance-checked", "verification": "provenance isomorphism checked; semantic-result proof remains specified"},
    {"id": "T17", "name": "Refinement preservation", "scope": "RX simulation", "status": "specified", "verification": "forward-simulation obligation declared"},
    {"id": "T18", "name": "Conservative extension", "scope": "R0 through RS", "status": "specified", "verification": "layerwise erasure theorem required"},
    {"id": "T19", "name": "Relative consistency", "scope": "verified erasure", "status": "specified", "verification": "conditional on total sound erasure translation"},
    {"id": "T20", "name": "Self-hosting adequacy", "scope": "RS", "status": "specified", "verification": "requires fixed-point and internal/external interpreter agreement"}
  ],
  "conformance": [
    "all syntax constructors have formation and typing rules",
    "relation and operation applications are signature-indexed",
    "revision source and target have identical sort",
    "governance is a state-transforming deductive system",
    "quotation is total on typed terms and eval is partial",
    "canonical code is explicitly recognized",
    "provenance uses strict acyclic precedence and replay isomorphism",
    "confidence scalars remain outside the core judgments",
    "implementation reports value, reducible, blocked, or invalid without hidden authorization",
    "no global strong-normalization claim is made for unrestricted reflection"
  ]
}
